{
  "$schema": "https://json-schema.org/draft/2020-12/schema",
  "$id": "https://github.com/special-place-ai-heaven/aap-runner/blob/main/parity/contracts/lifetime-clock.schema.json",
  "title": "The persisted clock record of the supervisor or the host watchdog: high-water mark of true time, boot id, counter and latched cap decisions (allocator.md, L7 and B2)",
  "x-contract-version": 1,
  "x-owner": "P12.3 (supervisor, role supervisor) and P10.7 (watchdog, role watchdog) write it; the providers read the watchdog's record for the start gate; consumers P02.1",
  "type": "object",
  "additionalProperties": false,
  "required": [
    "schema",
    "role",
    "boot_id",
    "mono_ms",
    "written_utc",
    "high_water_utc",
    "latched"
  ],
  "description": "Atomic record after each tick/run and after bounded enforcement attempts, never a prerequisite I/O before power-off. high_water_utc is nondecreasing and at least written_utc; decided_utc uses that high-water domain, floored at known reservation starts after clock loss. trigger deadline requires known elapsed_s at least cap_hours hours; host_reboot and clock_unavailable allow a nonnegative measured age or null, never fabricated elapsed time. enforcement_stage persists power_off_attempted, worker_stop_attempted, off or cap_breach; the next run resumes that stage instead of repeating E1 indefinitely. Only observed Off marks off; a cap_breach retains capacity, blocks starts and remains unresolved until verified recovery. mono_ms is boot-bound; boot_id changes each host boot.",
  "$defs": {
    "time": {
      "type": "string",
      "pattern": "^[0-9]{4}-[0-9]{2}-[0-9]{2}T[0-9]{2}:[0-9]{2}:[0-9]{2}Z$"
    },
    "latched": {
      "type": "object",
      "additionalProperties": false,
      "required": [
        "reservation_id",
        "vm_id",
        "decided_utc",
        "cap_hours",
        "elapsed_s",
        "trigger",
        "enforcement_stage"
      ],
      "properties": {
        "reservation_id": {
          "type": "string",
          "pattern": "^r-[0-9a-f]{16}$"
        },
        "vm_id": {
          "type": "string",
          "pattern": "^[0-9a-f]{8}-[0-9a-f]{4}-[0-9a-f]{4}-[0-9a-f]{4}-[0-9a-f]{12}$"
        },
        "decided_utc": {
          "$ref": "#/$defs/time"
        },
        "cap_hours": {
          "type": "integer",
          "minimum": 1,
          "maximum": 6
        },
        "elapsed_s": {
          "type": ["integer", "null"],
          "minimum": 0,
          "maximum": 31536000
        },
        "trigger": {
          "enum": ["deadline", "clock_unavailable", "host_reboot"]
        },
        "enforcement_stage": {
          "enum": ["power_off_attempted", "worker_stop_attempted", "off", "cap_breach"]
        }
      }
    }
  },
  "properties": {
    "schema": {
      "const": 1
    },
    "role": {
      "enum": [
        "supervisor",
        "watchdog"
      ]
    },
    "boot_id": {
      "type": "string",
      "pattern": "^[0-9a-f-]{8,64}$"
    },
    "mono_ms": {
      "type": "integer",
      "minimum": 0,
      "maximum": 9007199254740991
    },
    "written_utc": {
      "$ref": "#/$defs/time"
    },
    "high_water_utc": {
      "$ref": "#/$defs/time"
    },
    "latched": {
      "type": "array",
      "maxItems": 32,
      "items": {
        "$ref": "#/$defs/latched"
      }
    }
  }
}
