{
  "schema": 1,
  "role": "watchdog",
  "boot_id": "3f2a9c1e-7b4d-4e58-9a61-0c5d2b8e7f10",
  "mono_ms": 3600000,
  "written_utc": "2026-10-22T15:01:00Z",
  "high_water_utc": "2026-10-22T15:01:00Z",
  "latched": [
    {
      "reservation_id": "r-1a2b3c4d000000b1",
      "vm_id": "6f1d2c3b-4a59-4e6f-8a7b-9c0d1e2f3a4b",
      "decided_utc": "2026-10-22T15:00:30Z",
      "cap_hours": 6,
      "elapsed_s": 21630,
      "trigger": "deadline",
      "enforcement_stage": "cap_breach"
    }
  ]
}
